name,slug,category,description,price,old_price,image_url,badge,stock_quantity,featured,active
Set de Bandas de Resistencia Pro,set-bandas-resistencia-pro,fitness-gym,Set completo de 5 bandas de resistencia con diferentes niveles de tensión.,29.99,49.99,https://images.unsplash.com/photo-1598289431512-b97b0917affc?w=400&h=400&fit=crop,OFERTA,100,true,true
Pala de Pádel de Carbono Pro,pala-padel-carbono-pro,padel,Pala de pádel fabricada en carbono de alta resistencia con núcleo de goma EVA.,189.99,249.99,https://images.unsplash.com/photo-1626224583764-f87db24ac4ea?w=400&h=400&fit=crop,MÁS VENDIDO,50,true,true
Zapatillas de Running Ultra Comfort,zapatillas-running-ultra-comfort,ropa-deportiva,Zapatillas de running con amortiguación premium y suela flexible.,129.99,,,https://images.unsplash.com/photo-1542291026-7eec264c27ff?w=400&h=400&fit=crop,,200,true,true
Proteína Whey Isolate 2kg,proteina-whey-isolate-2kg,suplementos,Proteína de suero aislada de alta pureza con 27g de proteína por toma.,59.99,79.99,https://images.unsplash.com/photo-1593095948071-474c5cc2c989?w=400&h=400&fit=crop,OFERTA,150,true,true
Reloj Fitness Inteligente X1,reloj-fitness-inteligente-x1,accesorios,Reloj inteligente con GPS integrado y monitor cardíaco 24h.,249.99,,,https://images.unsplash.com/photo-1579586337278-3befd40fd17a?w=400&h=400&fit=crop,NUEVO,75,true,true
